{
  "$schema": "http://json-schema.org/draft-07/schema#",
  "title": "Swift Loop Formula Library Entry",
  "type": "object",
  "required": ["id", "name", "cols", "rows"],
  "anyOf": [{ "required": ["formulas"] }, { "required": ["steps"] }],
  "additionalProperties": false,
  "definitions": {
    "numericRamp": {
      "type": "object",
      "required": ["stops"],
      "additionalProperties": false,
      "description": "A multi-stop curve sampled along loop progress (t). One stop = a constant value; two or more = linearly interpolated between them.",
      "properties": {
        "stops": {
          "type": "array",
          "minItems": 1,
          "items": {
            "type": "object",
            "required": ["value", "position"],
            "additionalProperties": false,
            "properties": {
              "value": { "type": "number" },
              "position": { "type": "number", "minimum": 0, "maximum": 1 }
            }
          }
        }
      }
    }
  },
  "properties": {
    "id": { "type": "string", "pattern": "^[a-z0-9-]+$" },
    "name": { "type": "string", "minLength": 1, "maxLength": 40 },
    "description": { "type": "string", "maxLength": 200 },
    "tags": { "type": "array", "items": { "type": "string" }, "maxItems": 8 },
    "author": { "type": "string" },
    "cols": { "type": "integer", "minimum": 1, "maximum": 120 },
    "rows": { "type": "integer", "minimum": 1, "maximum": 120 },
    "layers": {
      "type": "integer",
      "minimum": 1,
      "maximum": 120,
      "description": "Number of depth layers (Z). The grid becomes a Columns × Rows × Layers lattice; each cell's layer index `l` (plus `layers` and `tz`) is exposed to formulas, which project it to 2D. Default 1 (flat)."
    },
    "angle": {
      "type": "number",
      "minimum": -360,
      "maximum": 360,
      "description": "Per-cell rotation in degrees applied to the grid offset around the source center. Cell i is rotated by `angle * i`. Use with cols ≥ 2 to trace spirals or swirl a 2D grid. For a varying lean, ship `angleRamp` instead."
    },
    "showFirst": {
      "type": "boolean",
      "description": "If true (default), the preview renders a clone at i=0. Set to false for patterns where i=0 naturally lands away from the origin (e.g. radial bursts) and the source should remain visually centered."
    },
    "formulas": {
      "type": "object",
      "additionalProperties": false,
      "properties": {
        "x": { "type": "string" },
        "y": { "type": "string" },
        "rotation": { "type": "string" },
        "scaleX": { "type": "string" },
        "scaleY": { "type": "string" },
        "opacity": { "type": "string" }
      }
    },
    "steps": {
      "type": "object",
      "additionalProperties": false,
      "description": "Pure-sugar position, applied with fx off so the X/Y step sliders drive the lattice. `x`/`y` are the primary column/row steps; columnStepY / rowStepX are the cross-axis drifts that shear the grid into oblique/isometric lattices.",
      "properties": {
        "x": { "type": "number" },
        "y": { "type": "number" },
        "columnStepY": { "type": "number" },
        "rowStepX": { "type": "number" }
      }
    },
    "ramps": {
      "type": "object",
      "additionalProperties": false,
      "description": "Pre-built appearance curves the pattern ships with, applied with fx off so the curve drives the value (a hand-drawn opacity fade, size taper, etc.). If a property also has a `formula`, the formula takes precedence.",
      "properties": {
        "rotation": { "$ref": "#/definitions/numericRamp" },
        "scaleX": { "$ref": "#/definitions/numericRamp" },
        "scaleY": { "$ref": "#/definitions/numericRamp" },
        "opacity": { "$ref": "#/definitions/numericRamp" },
        "strokeWeight": { "$ref": "#/definitions/numericRamp" }
      }
    },
    "angleRamp": {
      "allOf": [{ "$ref": "#/definitions/numericRamp" }],
      "description": "Pre-built Spiral curve. Cell i leans by `ramp(t_i) * i`, so a small→large curve tightens the spiral along the loop. Supersedes the scalar `angle`."
    }
  }
}
