{
  "id": "torus",
  "name": "Torus",
  "description": "A donut of dots seen at a tilt — Columns run around the ring, Rows around the tube. The near side of the ring grows and brightens, the far side recedes.",
  "tags": ["3d", "polar", "radial"],
  "author": "@swiftner",
  "cols": 28,
  "rows": 10,
  "layers": 1,
  "formulas": {
    "x": "x = ({x:150} + 42 * cos(r * TAU / rows)) * cos(c * TAU / cols)",
    "y": "y = ({y:150} + 42 * cos(r * TAU / rows)) * sin(c * TAU / cols) * 0.5 + 42 * sin(r * TAU / rows)",
    "scaleX": "scaleX = sin(c * TAU / cols) * 9",
    "scaleY": "scaleY = sin(c * TAU / cols) * 9",
    "opacity": "opacity = 72 + sin(c * TAU / cols) * 28"
  }
}
