{
  "id": "ring-tunnel",
  "name": "Ring Tunnel",
  "description": "Concentric rings receding into depth — each Layer is a ring, the far ones small and dim, the near ones wide and bright. A tunnel you can fly into. Raise Layers for more depth.",
  "tags": ["3d", "radial", "polar"],
  "author": "@swiftner",
  "cols": 20,
  "rows": 1,
  "layers": 8,
  "showFirst": false,
  "formulas": {
    "x": "x = cos(c * TAU / cols) * {x:150} * (0.35 + 0.65 * tz)",
    "y": "y = sin(c * TAU / cols) * {y:150} * (0.35 + 0.65 * tz) * 0.6 - (tz - 0.5) * 120",
    "scaleX": "scaleX = tz * 16 - 4",
    "scaleY": "scaleY = tz * 16 - 4",
    "opacity": "opacity = 35 + tz * 65"
  }
}
