{
  "id": "whirl",
  "name": "Whirl",
  "description": "A line wound into a spiral that tightens as it goes — the lean grows from gentle to sharp along the loop, and the tail fades out. Both curves are hand-drawn (no formula), so drag the Spiral and Opacity stops to reshape it.",
  "tags": ["spiral", "radial"],
  "author": "@swiftner",
  "cols": 60,
  "rows": 1,
  "showFirst": false,
  "formulas": {
    "x": "x = c * {x:12}",
    "y": "y = 0"
  },
  "angleRamp": {
    "stops": [
      { "value": 3, "position": 0 },
      { "value": 24, "position": 1 }
    ]
  },
  "ramps": {
    "opacity": {
      "stops": [
        { "value": 100, "position": 0 },
        { "value": 35, "position": 1 }
      ]
    }
  }
}
