{
  "id": "square-spiral",
  "name": "Square Spiral",
  "description": "An expanding square (Archimedean) spiral — the boxy cousin of Spiral. Radius grows with t while the squircle map keeps the turns square.",
  "tags": ["spiral", "tiling"],
  "author": "@swiftner",
  "cols": 120,
  "rows": 1,
  "formulas": {
    "x": "x = cos(t * TAU * 4) / max(abs(cos(t * TAU * 4)), abs(sin(t * TAU * 4))) * t * {x:200}",
    "y": "y = sin(t * TAU * 4) / max(abs(cos(t * TAU * 4)), abs(sin(t * TAU * 4))) * t * {y:200}"
  }
}
