{
  "id": "wave-field",
  "name": "Wave Field",
  "description": "A sheet of dots rippling in depth — Columns run across, Layers recede backward, and each dot rises and falls on a wave. The near rows read large and bright. Raise Layers for more depth.",
  "tags": ["3d", "wave", "grid"],
  "author": "@swiftner",
  "cols": 14,
  "rows": 1,
  "layers": 10,
  "showFirst": false,
  "formulas": {
    "x": "x = (c - (cols - 1) / 2) * {x:34} + (tz - 0.5) * 110",
    "y": "y = (tz - 0.5) * 80 + sin(c * 0.7 + l * 0.6) * {y:28}",
    "scaleX": "scaleX = (tz - 0.5) * 12",
    "scaleY": "scaleY = (tz - 0.5) * 12",
    "opacity": "opacity = 45 + tz * 55"
  }
}
