{
  "id": "cube",
  "name": "Cube",
  "description": "A 3D lattice of dots in oblique projection. Layers step back diagonally; nearer ones grow and brighten, farther ones shrink and dim. Drag X/Y to resize the cube, or Layers for its depth.",
  "tags": ["3d", "grid"],
  "author": "@swiftner",
  "cols": 5,
  "rows": 5,
  "layers": 5,
  "formulas": {
    "x": "x = (c - (cols - 1) / 2) * {x:64} + (l - (layers - 1) / 2) * 34",
    "y": "y = (r - (rows - 1) / 2) * {y:64} - (l - (layers - 1) / 2) * 34",
    "scaleX": "scaleX = (l - (layers - 1) / 2) * 4 - 8",
    "scaleY": "scaleY = (l - (layers - 1) / 2) * 4 - 8",
    "opacity": "opacity = 100 - (layers - 1 - l) * 11"
  }
}
