{
  "id": "vortex",
  "name": "Vortex",
  "description": "Tight inward spiral with shapes shrinking toward the center.",
  "tags": ["spiral", "radial", "scale"],
  "author": "@swiftner",
  "cols": 80, "rows": 1,
  "angle": 28,
  "showFirst": false,
  "formulas": {
    "x": "x = c * {x:6}",
    "y": "y = 0",
    "rotation": "rotation = c * 28",
    "scaleX": "scaleX = -t * w * 0.9",
    "scaleY": "scaleY = -t * h * 0.9",
    "opacity": "opacity = 30 + t * 70"
  }
}
