{
  "id": "checker",
  "name": "Checker",
  "description": "Uniform grid with alternating opacity by cell parity.",
  "tags": ["grid", "opacity"],
  "author": "@swiftner",
  "cols": 8, "rows": 8,
  "formulas": {
    "x": "x = c * w",
    "y": "y = r * h",
    "opacity": "opacity = ((c + r) mod 2) * 70 + 30"
  }
}
