{
  "id": "mandala",
  "name": "Mandala",
  "description": "Concentric rings rotated by the golden angle for layered symmetry.",
  "tags": ["polar", "radial", "grid", "organic"],
  "author": "@swiftner",
  "cols": 16, "rows": 5,
  "formulas": {
    "x": "x = cos(c * TAU / cols + r * 2.39996) * (r + 1) * {x:28}",
    "y": "y = sin(c * TAU / cols + r * 2.39996) * (r + 1) * {y:28}",
    "rotation": "rotation = (c * TAU / cols + r * 2.39996) * 180 / PI"
  }
}
