{
  "id": "truchet",
  "name": "Truchet",
  "description": "A uniform grid where every tile is rotated a random quarter-turn (0/90/180/270°). Reroll the seed for a new arrangement. Classic generative tiling — best with an asymmetric source shape.",
  "tags": ["grid", "tiling", "random"],
  "author": "@swiftner",
  "cols": 10,
  "rows": 10,
  "formulas": {
    "x": "x = c * w",
    "y": "y = r * h",
    "rotation": "rotation = floor(rand() * 4) * 90"
  }
}
