{
  "id": "heart",
  "name": "Heart",
  "description": "Cardioid heart curve, traced by the cells.",
  "tags": ["polar", "curve", "organic"],
  "author": "@swiftner",
  "cols": 80, "rows": 1,
  "showFirst": false,
  "formulas": {
    "x": "x = 16 * sin(t * TAU)^3 * {x:10}",
    "y": "y = -(13 * cos(t * TAU) - 5 * cos(t * TAU * 2) - 2 * cos(t * TAU * 3) - cos(t * TAU * 4)) * {y:10}"
  }
}
